{
  "schemaVersion": 1,
  "version": "2026.10.28",
  "generatedAt": "2026-10-28",
  "source": "scribekey-app/scribekey-model-research configs/cloud + tiers/results",
  "evidence": {
    "cleanup": {
      "identity": "b22f50e779ff91da",
      "cases": 240,
      "updated": "2026-10-09"
    },
    "enhance": {
      "identity": "d146114c42fb6bdd",
      "cases": 39,
      "updated": "2026-10-09"
    },
    "transcription": {
      "identity": "7e9d79ae0663426b",
      "cases": 156,
      "updated": "2026-10-09"
    }
  },
  "tasks": {
    "cleanup": {
      "providers": {
        "anthropic": {
          "recommended": "balanced",
          "tiers": {
            "best": {
              "model": "claude-haiku-5-5",
              "score": 0.9096,
              "p50Seconds": 1.206,
              "usdPer1k": 0.1237,
              "evaluated": "2026-10-09"
            },
            "balanced": {
              "model": "claude-haiku-5-5",
              "score": 0.9096,
              "p50Seconds": 1.206,
              "usdPer1k": 0.1237,
              "evaluated": "2026-10-09"
            },
            "fast": {
              "model": "claude-haiku-5-5",
              "score": 0.9096,
              "p50Seconds": 1.206,
              "usdPer1k": 0.1237,
              "evaluated": "2026-10-09"
            },
            "budget": {
              "model": "claude-haiku-5-5",
              "score": 0.9096,
              "p50Seconds": 1.206,
              "usdPer1k": 0.1237,
              "evaluated": "2026-10-09"
            }
          }
        },
        "cerebras": {
          "recommended": "balanced",
          "tiers": {
            "best": {
              "model": "gpt-oss-120b",
              "score": 0.8433,
              "p50Seconds": 0.356,
              "usdPer1k": 0.1026,
              "evaluated": "2026-10-09"
            },
            "balanced": {
              "model": "gpt-oss-120b",
              "score": 0.8433,
              "p50Seconds": 0.356,
              "usdPer1k": 0.1026,
              "evaluated": "2026-10-09"
            },
            "fast": {
              "model": "gpt-oss-120b",
              "score": 0.8433,
              "p50Seconds": 0.356,
              "usdPer1k": 0.1026,
              "evaluated": "2026-10-09"
            },
            "budget": {
              "model": "gpt-oss-120b",
              "score": 0.8433,
              "p50Seconds": 0.356,
              "usdPer1k": 0.1026,
              "evaluated": "2026-10-09"
            }
          }
        },
        "gemini": {
          "recommended": "balanced",
          "tiers": {
            "best": {
              "model": "gemini-3.8-flash",
              "score": 0.9251,
              "p50Seconds": 2.284,
              "usdPer1k": 0.8378,
              "evaluated": "2026-10-09"
            },
            "balanced": {
              "model": "gemini-3.1-flash-lite",
              "score": 0.9008,
              "p50Seconds": 0.802,
              "usdPer1k": 0.2006,
              "evaluated": "2026-10-09"
            },
            "fast": {
              "model": "gemini-3.5-flash-lite",
              "score": 0.8833,
              "p50Seconds": 0.739,
              "usdPer1k": 0.256,
              "evaluated": "2026-10-09"
            },
            "budget": {
              "model": "gemini-3.1-flash-lite",
              "score": 0.9008,
              "p50Seconds": 0.802,
              "usdPer1k": 0.2006,
              "evaluated": "2026-10-09"
            }
          }
        },
        "groq": {
          "recommended": "balanced",
          "tiers": {
            "best": {
              "model": "openai/gpt-oss-120b",
              "score": 0.8433,
              "p50Seconds": 0.356,
              "usdPer1k": 0.1026,
              "evaluated": "2026-10-09"
            },
            "balanced": {
              "model": "openai/gpt-oss-120b",
              "score": 0.8433,
              "p50Seconds": 0.356,
              "usdPer1k": 0.1026,
              "evaluated": "2026-10-09"
            },
            "fast": {
              "model": "openai/gpt-oss-120b",
              "score": 0.8433,
              "p50Seconds": 0.356,
              "usdPer1k": 0.1026,
              "evaluated": "2026-10-09"
            },
            "budget": {
              "model": "openai/gpt-oss-20b",
              "score": 0.8168,
              "p50Seconds": 0.414,
              "usdPer1k": 0.0524,
              "evaluated": "2026-10-09"
            }
          }
        },
        "openai": {
          "recommended": "balanced",
          "tiers": {
            "best": {
              "model": "gpt-5.4-mini",
              "score": 0.8873,
              "p50Seconds": 0.614,
              "usdPer1k": 0.5864,
              "evaluated": "2026-10-09"
            },
            "balanced": {
              "model": "gpt-6-luna",
              "score": 0.8796,
              "p50Seconds": 0.976,
              "usdPer1k": 0.076,
              "evaluated": "2026-10-09"
            },
            "fast": {
              "model": "gpt-5.4-mini",
              "score": 0.8873,
              "p50Seconds": 0.614,
              "usdPer1k": 0.5864,
              "evaluated": "2026-10-09"
            },
            "budget": {
              "model": "gpt-6-luna",
              "score": 0.8796,
              "p50Seconds": 0.976,
              "usdPer1k": 0.076,
              "evaluated": "2026-10-09"
            }
          }
        },
        "openrouter": {
          "recommended": "balanced",
          "tiers": {
            "best": {
              "model": "google/gemini-3.8-flash",
              "score": 0.9251,
              "p50Seconds": 2.284,
              "usdPer1k": 0.8378,
              "evaluated": "2026-10-09"
            },
            "balanced": {
              "model": "google/gemma-4-31b-it",
              "score": 0.9087,
              "p50Seconds": 0.618,
              "usdPer1k": 0.079,
              "evaluated": "2026-10-09"
            },
            "fast": {
              "model": "openai/gpt-5.4-mini",
              "score": 0.8873,
              "p50Seconds": 0.614,
              "usdPer1k": 0.5864,
              "evaluated": "2026-10-09"
            },
            "budget": {
              "model": "xiaomi/mimo-v2.6-flash",
              "score": 0.9133,
              "p50Seconds": 3.627,
              "usdPer1k": 0.0431,
              "evaluated": "2026-10-09"
            }
          }
        }
      }
    },
    "enhance": {
      "providers": {
        "anthropic": {
          "recommended": "balanced",
          "tiers": {
            "best": {
              "model": "claude-haiku-5-5",
              "score": 0.8974,
              "p50Seconds": 1.338,
              "usdPer1k": 0.2097,
              "evaluated": "2026-10-09"
            },
            "balanced": {
              "model": "claude-haiku-5-5",
              "score": 0.8974,
              "p50Seconds": 1.338,
              "usdPer1k": 0.2097,
              "evaluated": "2026-10-09"
            },
            "fast": {
              "model": "claude-haiku-5-5",
              "score": 0.8974,
              "p50Seconds": 1.338,
              "usdPer1k": 0.2097,
              "evaluated": "2026-10-09"
            },
            "budget": {
              "model": "claude-haiku-5-5",
              "score": 0.8974,
              "p50Seconds": 1.338,
              "usdPer1k": 0.2097,
              "evaluated": "2026-10-09"
            }
          }
        },
        "cerebras": {
          "recommended": "balanced",
          "tiers": {
            "best": {
              "model": "gpt-oss-120b",
              "score": 0.8974,
              "p50Seconds": 0.605,
              "usdPer1k": 0.1998,
              "evaluated": "2026-10-09"
            },
            "balanced": {
              "model": "gpt-oss-120b",
              "score": 0.8974,
              "p50Seconds": 0.605,
              "usdPer1k": 0.1998,
              "evaluated": "2026-10-09"
            },
            "fast": {
              "model": "gpt-oss-120b",
              "score": 0.8974,
              "p50Seconds": 0.605,
              "usdPer1k": 0.1998,
              "evaluated": "2026-10-09"
            },
            "budget": {
              "model": "gpt-oss-120b",
              "score": 0.8974,
              "p50Seconds": 0.605,
              "usdPer1k": 0.1998,
              "evaluated": "2026-10-09"
            }
          }
        },
        "gemini": {
          "recommended": "balanced",
          "tiers": {
            "best": {
              "model": "gemini-3.8-flash",
              "score": 1.0,
              "p50Seconds": 4.429,
              "usdPer1k": 1.6735,
              "evaluated": "2026-10-09"
            },
            "balanced": {
              "model": "gemini-3.1-flash-lite",
              "score": 0.9573,
              "p50Seconds": 1.037,
              "usdPer1k": 0.307,
              "evaluated": "2026-10-09"
            },
            "fast": {
              "model": "gemini-3.1-flash-lite",
              "score": 0.9573,
              "p50Seconds": 1.037,
              "usdPer1k": 0.307,
              "evaluated": "2026-10-09"
            },
            "budget": {
              "model": "gemini-3.1-flash-lite",
              "score": 0.9573,
              "p50Seconds": 1.037,
              "usdPer1k": 0.307,
              "evaluated": "2026-10-09"
            }
          }
        },
        "groq": {
          "recommended": "balanced",
          "tiers": {
            "best": {
              "model": "openai/gpt-oss-120b",
              "score": 0.8974,
              "p50Seconds": 0.605,
              "usdPer1k": 0.1998,
              "evaluated": "2026-10-09"
            },
            "balanced": {
              "model": "openai/gpt-oss-120b",
              "score": 0.8974,
              "p50Seconds": 0.605,
              "usdPer1k": 0.1998,